{
  "$schema": "https://json-schema.org/draft/2020-12/schema",
  "$id": "https://cassini.local/spec/cassini-portable-meeting-manifest-v2.schema.json",
  "title": "Cassini Portable Meeting Manifest v2",
  "type": "object",
  "additionalProperties": false,
  "required": [
    "kind",
    "version",
    "profile",
    "meeting",
    "audio",
    "integrity",
    "speakers",
    "transcripts"
  ],
  "properties": {
    "kind": { "const": "cassini-portable-meeting" },
    "version": { "const": 2 },
    "profile": { "const": "ogg-opus" },
    "meeting": { "$ref": "#/$defs/meeting" },
    "audio": { "$ref": "#/$defs/audio" },
    "integrity": { "$ref": "#/$defs/integrity" },
    "speakers": {
      "type": "array",
      "items": { "$ref": "#/$defs/speaker" }
    },
    "transcripts": {
      "type": "array",
      "minItems": 1,
      "items": { "$ref": "#/$defs/transcriptEntry" }
    },
    "readableTranscripts": {
      "type": "array",
      "items": { "$ref": "#/$defs/readableTranscriptEntry" }
    },
    "provenance": {
      "type": "object",
      "additionalProperties": false,
      "properties": {
        "speechToText": {
          "type": "object",
          "additionalProperties": { "$ref": "#/$defs/processingStep" }
        },
        "readableCleanup": {
          "type": "object",
          "additionalProperties": { "$ref": "#/$defs/processingStep" }
        },
        "displayTranscript": {
          "type": "object",
          "additionalProperties": { "$ref": "#/$defs/processingStep" }
        },
        "meetingSummary": { "$ref": "#/$defs/processingStep" },
        "attribution": { "$ref": "#/$defs/attributionProvenance" },
        "wordTimings": { "$ref": "#/$defs/wordTimingProvenance" }
      }
    },
    "chapters": {
      "type": "array",
      "items": { "$ref": "#/$defs/chapter" }
    },
    "summary": { "type": "object" },
    "attachments": { "type": "array" }
  },
  "$defs": {
    "meeting": {
      "type": "object",
      "additionalProperties": false,
      "required": ["id", "title", "createdAtUtc", "durationMs"],
      "properties": {
        "id": { "type": "string", "minLength": 1 },
        "title": { "type": "string", "minLength": 1 },
        "createdAtUtc": { "type": "string", "format": "date-time" },
        "recordedAtLocal": { "type": "string" },
        "processedAtUtc": { "type": "string", "format": "date-time" },
        "durationMs": { "type": "integer", "minimum": 0 },
        "language": { "type": "string" },
        "roomId": { "type": "string", "pattern": "^rm_[0-9a-f]{16}$", "description": "Id of the conversation this meeting was recorded in: a deterministic one-way derivation of the room's identity, never the identity itself. For a Nextcloud Talk recording it derives from the conversation token, which is also that room's join link and is therefore never published. Shaped rm_<16 lowercase hex>. Absent when the room is unknown." },
        "roomName": { "type": "string", "description": "LEGACY, read-only. The room's display name frozen at record time. Producers stopped writing this: a display name is editable and a published recording is not, so the current name lives in the catalog entry instead. The record-time name is still available as the meeting title. Absent in anything packed after that change." },
        "jobId": { "type": "string", "description": "Id of the operator job that produced this artifact. Absent when the producer was not an operator job. Discloses nothing new: the operator publishes the artifact under this same id." },
        "attemptNumber": { "type": "integer", "minimum": 1, "description": "Which attempt of that job produced this artifact, 1-based. Absent when unknown. There is no separate attempt id: an attempt's identity is the pair (jobId, attemptNumber)." },
        "summary": { "type": "string" }
      }
    },
    "audio": {
      "type": "object",
      "additionalProperties": false,
      "required": ["container", "codec", "sampleRate", "channels", "sampleCount", "durationMs"],
      "properties": {
        "container": { "const": "ogg" },
        "codec": { "const": "opus" },
        "sampleRate": { "const": 48000 },
        "channels": { "type": "integer", "enum": [1, 2] },
        "sampleCount": { "type": "integer", "minimum": 0 },
        "durationMs": { "type": "integer", "minimum": 0 }
      }
    },
    "integrity": {
      "type": "object",
      "additionalProperties": false,
      "required": ["matchPolicy", "pcmFormat", "pcmSha256", "sampleRate", "channels", "sampleCount", "durationMs"],
      "properties": {
        "matchPolicy": { "const": "exact-pcm" },
        "pcmFormat": { "const": "s16le" },
        "pcmSha256": { "type": "string", "pattern": "^[0-9a-f]{64}$" },
        "containerSha256": { "type": "string", "pattern": "^[0-9a-f]{64}$" },
        "sampleRate": { "const": 48000 },
        "channels": { "type": "integer", "enum": [1, 2] },
        "sampleCount": { "type": "integer", "minimum": 0 },
        "durationMs": { "type": "integer", "minimum": 0 }
      }
    },
    "speaker": {
      "type": "object",
      "additionalProperties": false,
      "required": ["id", "label"],
      "properties": {
        "id": { "type": "string", "minLength": 1 },
        "label": { "type": "string", "minLength": 1 }
      }
    },
    "transcriptEntry": {
      "type": "object",
      "additionalProperties": false,
      "required": ["id", "role", "format", "payloadRef"],
      "properties": {
        "id": { "$ref": "#/$defs/transcriptId" },
        "role": { "enum": ["raw-asr", "human-corrected", "translation"] },
        "default": { "type": "boolean" },
        "format": { "type": "string", "minLength": 1 },
        "language": { "type": "string" },
        "wordCount": { "type": "integer", "minimum": 0 },
        "createdAtUtc": { "type": "string", "format": "date-time" },
        "payloadRef": { "$ref": "#/$defs/payloadRef" }
      }
    },
    "readableTranscriptEntry": {
      "type": "object",
      "additionalProperties": false,
      "required": ["id", "role", "format", "sourceTranscriptId", "payloadRef"],
      "properties": {
        "id": { "$ref": "#/$defs/transcriptId" },
        "role": { "enum": ["readable-cleanup", "display"] },
        "default": { "type": "boolean" },
        "format": { "type": "string", "minLength": 1 },
        "language": { "type": "string" },
        "sourceTranscriptId": { "$ref": "#/$defs/transcriptId" },
        "createdAtUtc": { "type": "string", "format": "date-time" },
        "payloadRef": { "$ref": "#/$defs/payloadRef" }
      }
    },
    "transcriptId": {
      "type": "string",
      "pattern": "^[a-z0-9][a-z0-9_-]{0,31}$"
    },
    "payloadRef": {
      "type": "object",
      "additionalProperties": false,
      "required": ["prefix", "chunkCount", "sha256", "rawBytes", "gzipBytes", "mime", "encoding"],
      "properties": {
        "prefix": {
          "type": "string",
          "pattern": "^CASSINI_TX_[A-Z0-9_]+_PAYLOAD_$"
        },
        "chunkCount": { "type": "integer", "minimum": 1 },
        "sha256": { "type": "string", "pattern": "^[0-9a-f]{64}$" },
        "rawBytes": { "type": "integer", "minimum": 0 },
        "gzipBytes": { "type": "integer", "minimum": 0 },
        "mime": { "type": "string", "minLength": 1 },
        "encoding": { "type": "string", "minLength": 1 }
      }
    },
    "processingStep": {
      "type": "object",
      "additionalProperties": false,
      "properties": {
        "backend": { "type": "string" },
        "engine": { "type": "string" },
        "model": { "type": "string" },
        "device": { "type": "string" },
        "language": { "type": "string" },
        "baseUrl": { "type": "string" },
        "host": { "type": "string" },
        "source": { "type": "string" },
        "version": { "type": "string" }
      }
    },
    "attributionProvenance": {
      "type": "object",
      "additionalProperties": false,
      "required": ["ran", "mode", "wordsMeasured", "wordsFlagged", "wordsDropped"],
      "properties": {
        "ran": { "type": "boolean", "description": "Whether the cross-track attribution stage ran against this file's default raw transcript." },
        "mode": { "type": "string", "minLength": 1, "description": "How flagged words were handled: annotate (per-word evidence kept on the words), drop (flagged words deleted before publication; this record is then the only trace they existed), or disabled." },
        "reason": { "type": "string", "description": "Why the stage did not run. Absent when ran is true." },
        "wordsMeasured": { "type": "integer", "minimum": 0 },
        "wordsFlagged": { "type": "integer", "minimum": 0 },
        "wordsDropped": { "type": "integer", "minimum": 0 },
        "thresholdDb": { "type": "number", "description": "The meeting's estimated crosstalk threshold in dB. Absent when the meeting showed no crosstalk population." }
      }
    },
    "wordTimingProvenance": {
      "type": "object",
      "additionalProperties": false,
      "required": ["endsBoundedByAudio"],
      "description": "How the producer decided where each word ends. Absent on files produced before the rule changed, and on files whose speech recognizer makes no such guarantee \u2014 in both cases a word's end came from its last token including a trailing punctuation mark — a mark the recognizer stamps at the next acoustic onset, so such a word can run for seconds while its speaker is silent. A consumer keys off presence: absent means those ends are unmeasured and a repair that clips an over-long word is appropriate; present means they were measured and clipping them destroys correct timing.",
      "properties": {
        "endsBoundedByAudio": { "type": "boolean", "description": "True when each word's end was measured against its own speaker's track rather than taken from its last token's timestamp." }
      }
    },
    "chapter": {
      "type": "object",
      "additionalProperties": false,
      "required": ["startMs", "title"],
      "properties": {
        "startMs": { "type": "integer", "minimum": 0 },
        "endMs": { "type": "integer", "minimum": 0 },
        "title": { "type": "string", "minLength": 1 }
      }
    }
  }
}
