{
  "kind": "cassini-portable-meeting",
  "version": 2,
  "profile": "ogg-opus",
  "meeting": {
    "id": "mtg_examplehashexamplehashexamplehashexamplehashexamplehashexample",
    "title": "Weekly Sync (parakeet + canary)",
    "createdAtUtc": "2026-05-12T14:30:00Z",
    "durationMs": 1800000,
    "language": "en"
  },
  "audio": {
    "container": "ogg",
    "codec": "opus",
    "sampleRate": 48000,
    "channels": 1,
    "sampleCount": 86400000,
    "durationMs": 1800000
  },
  "integrity": {
    "matchPolicy": "exact-pcm",
    "pcmFormat": "s16le",
    "pcmSha256": "aaaaaaaaaaaaaaaaaaaaaaaaaaaaaaaaaaaaaaaaaaaaaaaaaaaaaaaaaaaaaaaa",
    "sampleRate": 48000,
    "channels": 1,
    "sampleCount": 86400000,
    "durationMs": 1800000
  },
  "speakers": [
    { "id": "speaker_0", "label": "Alice" },
    { "id": "speaker_1", "label": "Bob" }
  ],
  "transcripts": [
    {
      "id": "parakeet",
      "role": "raw-asr",
      "default": false,
      "format": "cassini.words.v1",
      "language": "en",
      "wordCount": 4521,
      "createdAtUtc": "2026-05-12T14:35:00Z",
      "payloadRef": {
        "prefix": "CASSINI_TX_PARAKEET_PAYLOAD_",
        "chunkCount": 14,
        "sha256": "bbbbbbbbbbbbbbbbbbbbbbbbbbbbbbbbbbbbbbbbbbbbbbbbbbbbbbbbbbbbbbbb",
        "rawBytes": 361680,
        "gzipBytes": 110824,
        "mime": "application/vnd.cassini.transcript-words+json",
        "encoding": "base64url+gzip+utf8json"
      }
    },
    {
      "id": "canary",
      "role": "raw-asr",
      "default": true,
      "format": "cassini.words.v1",
      "language": "en",
      "wordCount": 4612,
      "createdAtUtc": "2026-05-12T14:40:00Z",
      "payloadRef": {
        "prefix": "CASSINI_TX_CANARY_PAYLOAD_",
        "chunkCount": 14,
        "sha256": "cccccccccccccccccccccccccccccccccccccccccccccccccccccccccccccccc",
        "rawBytes": 368960,
        "gzipBytes": 112440,
        "mime": "application/vnd.cassini.transcript-words+json",
        "encoding": "base64url+gzip+utf8json"
      }
    }
  ],
  "readableTranscripts": [
    {
      "id": "readable-qwen",
      "role": "readable-cleanup",
      "default": true,
      "format": "cassini.readable.v1",
      "language": "en",
      "sourceTranscriptId": "canary",
      "createdAtUtc": "2026-05-12T14:45:00Z",
      "payloadRef": {
        "prefix": "CASSINI_TX_READABLE_QWEN_PAYLOAD_",
        "chunkCount": 6,
        "sha256": "dddddddddddddddddddddddddddddddddddddddddddddddddddddddddddddddd",
        "rawBytes": 142000,
        "gzipBytes": 41200,
        "mime": "application/vnd.cassini.transcript-readable+json",
        "encoding": "base64url+gzip+utf8json"
      }
    }
  ],
  "provenance": {
    "speechToText": {
      "parakeet": {
        "backend": "sherpa-onnx-go",
        "engine": "sherpa-onnx",
        "model": "parakeet-tdt-0.6b-v2-int8",
        "device": "cuda",
        "language": "en"
      },
      "canary": {
        "backend": "sherpa-onnx-go",
        "engine": "sherpa-onnx",
        "model": "canary-1b-v2",
        "device": "cuda",
        "language": "en"
      }
    },
    "readableCleanup": {
      "readable-qwen": {
        "backend": "openai-compatible",
        "engine": "llama.cpp",
        "model": "cassini-cleanup-qwen35-0.8b-v35-q4km",
        "source": "generated"
      }
    }
  }
}
